{
  "type": "service_account",
  "project_id": "chat-app",
  "private_key_id": "9c9c9c9c9c9c9c9c9c9c9c9c9c9c9c9c9c9c9c9c",
  "private_key": "-----BEGIN PRIVATE KEY-----\nMIIEvQIBADANBgkqhkiG9w0BAQEFAASC\n-----END PRIVATE KEY-----\n",
  "client_email": "backend@chat-app.sa.aruma.example.com",
  "client_id": "112233445566778899001",
  "auth_uri": "https://aruma.example.com/oauth2/v1/auth",
  "token_uri": "https://aruma.example.com/oauth2/v1/token",
  "auth_provider_x509_cert_url": "https://aruma.example.com/oauth2/v1/certs",
  "client_x509_cert_url": "https://aruma.example.com/oauth2/v1/x509/backend@chat-app.sa.aruma.example.com"
}
